[
  { "entry_id": "jjk.es.cursed_energy", "locale": "es", "namespace": "EXTENSION", "version": "1.0.0", "surface_forms": ["energia maldita", "energía maldita"], "canonical_type": "USE_ABILITY", "canonical_subtype": null, "ability_id": "jjk.raw_energy_blast", "tags": ["resource"], "priority": 20, "constraints": { "ability_context_only": true }, "examples": [], "source": "jjk.reference" },
  { "entry_id": "jjk.en.cursed_energy", "locale": "en", "namespace": "EXTENSION", "version": "1.0.0", "surface_forms": ["cursed energy"], "canonical_type": "USE_ABILITY", "canonical_subtype": null, "ability_id": "jjk.raw_energy_blast", "tags": ["resource"], "priority": 20, "constraints": { "ability_context_only": true }, "examples": [], "source": "jjk.reference" },
  { "entry_id": "jjk.es.reinforcement", "locale": "es", "namespace": "EXTENSION", "version": "1.0.0", "surface_forms": ["refuerzo", "refuerzo de energia"], "canonical_type": "USE_ABILITY", "canonical_subtype": null, "ability_id": "jjk.reinforcement", "tags": ["defense"], "priority": 20, "constraints": { "ability_context_only": true }, "examples": [], "source": "jjk.reference" },
  { "entry_id": "jjk.en.reinforcement", "locale": "en", "namespace": "EXTENSION", "version": "1.0.0", "surface_forms": ["reinforcement"], "canonical_type": "USE_ABILITY", "canonical_subtype": null, "ability_id": "jjk.reinforcement", "tags": ["defense"], "priority": 20, "constraints": { "ability_context_only": true }, "examples": [], "source": "jjk.reference" },
  { "entry_id": "jjk.es.reverse", "locale": "es", "namespace": "EXTENSION", "version": "1.0.0", "surface_forms": ["tecnica maldita inversa", "técnica maldita inversa"], "canonical_type": "USE_ABILITY", "canonical_subtype": null, "ability_id": "jjk.reverse_recovery", "tags": ["recovery"], "priority": 20, "constraints": { "ability_context_only": true }, "examples": [], "source": "jjk.reference" },
  { "entry_id": "jjk.en.reverse", "locale": "en", "namespace": "EXTENSION", "version": "1.0.0", "surface_forms": ["reverse cursed technique"], "canonical_type": "USE_ABILITY", "canonical_subtype": null, "ability_id": "jjk.reverse_recovery", "tags": ["recovery"], "priority": 20, "constraints": { "ability_context_only": true }, "examples": [], "source": "jjk.reference" },
  { "entry_id": "jjk.es.barrier", "locale": "es", "namespace": "EXTENSION", "version": "1.0.0", "surface_forms": ["barrera"], "canonical_type": "USE_ABILITY", "canonical_subtype": null, "ability_id": "jjk.barrier_field", "tags": ["barrier"], "priority": 20, "constraints": { "ability_context_only": true }, "examples": [], "source": "jjk.reference" },
  { "entry_id": "jjk.en.domain", "locale": "en", "namespace": "EXTENSION", "version": "1.0.0", "surface_forms": ["domain expansion"], "canonical_type": "USE_ABILITY", "canonical_subtype": null, "ability_id": "jjk.synthetic_domain", "tags": ["domain"], "priority": 20, "constraints": { "ability_context_only": true }, "examples": [], "source": "jjk.reference" },
  { "entry_id": "jjk.es.domain", "locale": "es", "namespace": "EXTENSION", "version": "1.0.0", "surface_forms": ["expansion de dominio", "expansión de dominio"], "canonical_type": "USE_ABILITY", "canonical_subtype": null, "ability_id": "jjk.synthetic_domain", "tags": ["domain"], "priority": 20, "constraints": { "ability_context_only": true }, "examples": [], "source": "jjk.reference" },
  { "entry_id": "jjk.es.vow", "locale": "es", "namespace": "EXTENSION", "version": "1.0.0", "surface_forms": ["voto vinculante"], "canonical_type": "OBSERVE", "canonical_subtype": null, "ability_id": null, "tags": ["binding_vow"], "priority": 20, "constraints": {}, "examples": [], "source": "jjk.reference" },
  { "entry_id": "jjk.en.shikigami", "locale": "en", "namespace": "EXTENSION", "version": "1.0.0", "surface_forms": ["shikigami"], "canonical_type": "USE_ABILITY", "canonical_subtype": null, "ability_id": "jjk.summon_assistant", "tags": ["summon"], "priority": 20, "constraints": { "ability_context_only": true }, "examples": [], "source": "jjk.reference" },
  { "entry_id": "jjk.es.tool", "locale": "es", "namespace": "EXTENSION", "version": "1.0.0", "surface_forms": ["herramienta maldita"], "canonical_type": "USE_OBJECT", "canonical_subtype": null, "ability_id": null, "tags": ["cursed_tool"], "priority": 20, "constraints": { "requires_object": true }, "examples": [], "source": "jjk.reference" }
]
